{
  "format": "showtime-project",
  "version": "1.0",
  "project": {
    "name": "苏轼与北宋背景",
    "description": "以苏轼生平与作品为主线，并列北宋政治、同时代人物与关键锚点，演示从专题年谱走向共时背景比较的完整工作流。",
    "topic": "苏轼、北宋文学与政治",
    "createdAt": "2026-07-13T00:00:00.000Z",
    "updatedAt": "2026-07-13T00:00:00.000Z"
  },
  "groups": [
    { "id": "group-main", "name": "主线", "order": 0, "collapsed": false, "visible": true },
    { "id": "group-works", "name": "作品", "order": 1, "collapsed": false, "visible": true },
    { "id": "group-politics", "name": "政治背景", "order": 2, "collapsed": false, "visible": true },
    { "id": "group-people", "name": "同时代人物", "order": 3, "collapsed": false, "visible": true },
    { "id": "group-anchor", "name": "锚点", "order": 4, "collapsed": false, "visible": true }
  ],
  "layers": [
    { "id": "sushi-overview", "name": "苏轼生平 overview", "file": "01_苏轼生平_overview.csv", "role": "primary", "groupId": "group-main", "order": 0, "color": "#4da3ff", "visible": true, "lod": { "key": "sushi-life", "level": "overview", "switchSpan": 45 } },
    { "id": "sushi-detailed", "name": "苏轼生平 detailed", "file": "01_苏轼生平_detailed.csv", "role": "primary", "groupId": "group-main", "order": 1, "color": "#4da3ff", "visible": true, "lod": { "key": "sushi-life", "level": "detailed", "switchSpan": 45 } },
    { "id": "sushi-works", "name": "苏轼作品", "file": "02_苏轼作品.csv", "role": "primary", "groupId": "group-works", "order": 2, "color": "#65c7a5", "visible": true },
    { "id": "song-politics", "name": "北宋政治背景", "file": "03_北宋政治背景.csv", "role": "context", "groupId": "group-politics", "order": 3, "color": "#8798b4", "visible": true },
    { "id": "contemporaries", "name": "同时代人物", "file": "04_同时代人物.csv", "role": "context", "groupId": "group-people", "order": 4, "color": "#a585d8", "visible": true },
    { "id": "anchors", "name": "研究锚点", "file": "05_研究锚点.csv", "role": "anchor", "groupId": "group-anchor", "order": 5, "color": "#f3b33d", "visible": true }
  ],
  "timeRange": { "start": 960, "end": 1127 },
  "initialView": { "start": 1015, "end": 1110 },
  "lodMode": "auto",
  "views": [
    {
      "id": "view-mizhou", "name": "密州时期", "createdAt": "2026-07-13T00:00:00.000Z",
      "view": { "start": 1073, "end": 1078 },
      "layers": [
        { "id": "sushi-overview", "order": 0, "visible": true, "color": "#4da3ff", "groupId": "group-main" },
        { "id": "sushi-detailed", "order": 1, "visible": true, "color": "#4da3ff", "groupId": "group-main" },
        { "id": "sushi-works", "order": 2, "visible": true, "color": "#65c7a5", "groupId": "group-works" },
        { "id": "song-politics", "order": 3, "visible": true, "color": "#8798b4", "groupId": "group-politics" },
        { "id": "contemporaries", "order": 4, "visible": true, "color": "#a585d8", "groupId": "group-people" },
        { "id": "anchors", "order": 5, "visible": true, "color": "#f3b33d", "groupId": "group-anchor" }
      ],
      "groups": [
        { "id": "group-main", "order": 0, "collapsed": false, "visible": true },
        { "id": "group-works", "order": 1, "collapsed": false, "visible": true },
        { "id": "group-politics", "order": 2, "collapsed": false, "visible": true },
        { "id": "group-people", "order": 3, "collapsed": true, "visible": true },
        { "id": "group-anchor", "order": 4, "collapsed": false, "visible": true }
      ],
      "filters": { "locations": ["密州"] }, "search": { "query": "", "scope": "all", "dimUnmatched": false, "onlyMatches": false },
      "probes": [{ "id": "probe-mizhou", "time": 1076, "windowMode": "1y", "precision": "year", "pinned": true }],
      "selectedEventId": null, "lodMode": "auto"
    },
    {
      "id": "view-wutai", "name": "乌台诗案前后", "createdAt": "2026-07-13T00:00:00.000Z",
      "view": { "start": 1077, "end": 1085 },
      "layers": [
        { "id": "sushi-overview", "order": 0, "visible": true, "color": "#4da3ff", "groupId": "group-main" },
        { "id": "sushi-detailed", "order": 1, "visible": true, "color": "#4da3ff", "groupId": "group-main" },
        { "id": "sushi-works", "order": 2, "visible": true, "color": "#65c7a5", "groupId": "group-works" },
        { "id": "song-politics", "order": 3, "visible": true, "color": "#8798b4", "groupId": "group-politics" },
        { "id": "contemporaries", "order": 4, "visible": true, "color": "#a585d8", "groupId": "group-people" },
        { "id": "anchors", "order": 5, "visible": true, "color": "#f3b33d", "groupId": "group-anchor" }
      ],
      "groups": [
        { "id": "group-main", "order": 0, "collapsed": false, "visible": true },
        { "id": "group-works", "order": 1, "collapsed": false, "visible": true },
        { "id": "group-politics", "order": 2, "collapsed": false, "visible": true },
        { "id": "group-people", "order": 3, "collapsed": false, "visible": true },
        { "id": "group-anchor", "order": 4, "collapsed": false, "visible": true }
      ],
      "filters": {}, "search": { "query": "乌台诗案", "scope": "all", "dimUnmatched": true, "onlyMatches": false },
      "probes": [
        { "id": "probe-before", "time": 1078, "windowMode": "1y", "precision": "year", "pinned": true },
        { "id": "probe-after", "time": 1082, "windowMode": "1y", "precision": "year", "pinned": true }
      ],
      "selectedEventId": null, "lodMode": "auto"
    }
  ],
  "bookmarks": [
    { "id": "bookmark-wutai", "name": "乌台诗案", "time": 1079, "note": "观察案件前后任官、创作与政治背景的变化。" }
  ],
  "probes": [
    { "id": "recommended-wutai", "time": 1079, "label": "乌台诗案", "windowMode": "1y", "precision": "year", "pinned": true }
  ],
  "metadata": { "events": "event_meta.json", "sources": "sources.csv", "references": "references.md" }
}
